{
  "artifacts": {
    "config_sha256": "465f1ad4d2d5426b785b453740fe894dcfe33e837fa6d752bc2f55a25959de71",
    "model_exports": [],
    "software_revision": "8379a19555a3e7c80c376d21e3ca7bbda9887f4c"
  },
  "coverage": {
    "accuracy": "not_applicable_phase0_no_model",
    "active_search": "not_applicable_phase0_passive_only",
    "identity": "not_applicable_phase0_no_tracker"
  },
  "dataset_id": "human_tracking_lidar_20260706_150711",
  "gates": {
    "manifest_localization_mode_respected": true,
    "no_forward_permission": true,
    "replay_rate_consistent": true,
    "required_topic_window_complete": true,
    "sync_p95_at_most_80_ms": true
  },
  "latency_metrics": {
    "image_callback": {
      "count": 624,
      "maximum_sec": 0.000147,
      "mean_sec": 6.6e-05,
      "p95_sec": 8e-05
    },
    "lidar_callback": {
      "count": 862,
      "maximum_sec": 0.000909,
      "mean_sec": 5.6e-05,
      "p95_sec": 7e-05
    }
  },
  "localization": {
    "epoch_id_sequence": [
      1,
      1,
      1,
      1,
      1,
      1,
      1,
      1,
      1,
      1,
      1,
      1,
      1,
      1,
      1,
      1,
      1,
      1,
      1,
      1,
      1,
      1,
      1,
      1,
      1,
      1,
      1,
      1,
      1,
      1,
      1,
      1,
      1,
      1,
      1,
      1,
      1,
      1,
      1,
      1,
      1,
      1,
      1,
      1,
      1,
      1,
      1,
      1,
      1,
      1,
      1,
      1,
      1,
      1,
      1,
      1,
      1,
      1,
      1,
      1,
      1,
      1,
      1,
      1,
      1,
      1,
      1,
      1,
      1,
      1,
      1,
      1,
      1,
      1,
      1,
      1,
      1,
      1,
      1,
      1,
      1,
      1,
      1,
      1,
      1,
      1,
      1,
      1,
      1,
      1,
      1,
      1,
      1,
      1,
      1,
      1,
      1,
      1,
      1,
      1,
      1,
      1,
      1,
      1,
      1,
      1,
      1,
      1,
      1,
      1,
      1,
      1,
      1,
      1,
      1,
      1,
      1,
      1,
      1,
      1,
      1,
      1,
      1,
      1,
      1,
      1,
      1,
      1,
      1,
      1,
      1,
      1,
      1,
      1,
      1,
      1,
      1,
      1,
      1,
      1,
      1,
      1,
      1,
      1,
      1,
      1,
      1,
      1,
      1,
      1,
      1,
      1,
      1,
      1,
      1,
      1,
      1,
      1,
      1,
      1,
      1,
      1,
      1,
      1,
      1,
      1,
      1,
      1,
      1,
      1,
      1,
      1,
      1,
      1,
      1,
      1,
      1,
      1,
      1,
      1,
      1,
      1,
      1,
      1,
      1,
      1,
      1,
      1,
      1,
      1,
      1,
      1,
      1,
      1,
      1,
      1,
      1,
      1,
      1,
      1,
      1,
      1,
      1,
      1,
      1,
      1,
      1,
      1,
      1,
      1,
      1,
      1,
      1,
      1,
      1,
      1,
      1,
      1,
      1,
      1,
      1,
      1,
      1,
      1,
      1,
      1,
      1,
      1,
      1,
      1,
      1,
      1,
      1,
      1,
      1,
      1,
      1,
      1,
      1,
      1,
      1,
      1,
      1,
      1,
      1,
      1,
      1,
      1,
      1,
      1,
      1,
      1,
      1,
      1,
      1,
      1,
      1,
      1,
      1,
      1,
      1,
      1,
      1,
      1,
      1,
      1,
      1,
      1,
      1,
      1,
      1,
      1,
      1,
      1,
      1,
      1,
      1,
      1,
      1,
      1,
      1,
      1,
      1,
      1,
      1,
      1,
      1,
      1,
      1,
      1,
      1,
      1,
      1,
      1,
      1,
      1,
      1,
      1,
      1,
      1,
      1,
      1,
      1,
      1,
      1,
      1,
      1,
      1,
      1,
      1,
      1,
      1,
      1,
      1,
      1,
      1,
      1,
      1,
      1,
      1,
      1,
      1,
      1,
      1,
      1,
      1,
      1,
      1,
      1,
      1,
      1,
      1,
      1,
      1,
      1,
      1,
      1,
      1,
      1,
      1,
      1,
      1,
      1,
      1,
      1,
      1,
      1,
      1,
      1,
      1,
      1,
      1,
      1,
      1,
      1,
      1,
      1,
      1,
      1,
      1,
      1,
      1,
      1,
      1,
      1,
      1,
      1,
      1,
      1,
      1,
      1,
      1,
      1,
      1,
      1,
      1,
      1,
      1,
      1,
      1,
      1,
      1,
      1,
      1,
      1,
      1,
      1,
      1,
      1,
      1,
      1,
      1,
      1,
      1,
      1,
      1,
      1,
      1,
      1,
      1,
      1,
      1,
      1,
      1,
      1,
      1,
      1,
      1,
      1,
      1,
      1,
      1,
      1,
      1,
      1,
      1,
      1,
      1,
      1,
      1,
      1,
      1,
      1,
      1,
      1,
      1,
      1,
      1,
      1,
      1,
      1
    ],
    "epoch_ids": [
      1
    ],
    "epochs_valid": true,
    "mode_counts": {
      "OBSERVATION_ONLY": 431
    },
    "mode_sequence": [
      "OBSERVATION_ONLY",
      "OBSERVATION_ONLY",
      "OBSERVATION_ONLY",
      "OBSERVATION_ONLY",
      "OBSERVATION_ONLY",
      "OBSERVATION_ONLY",
      "OBSERVATION_ONLY",
      "OBSERVATION_ONLY",
      "OBSERVATION_ONLY",
      "OBSERVATION_ONLY",
      "OBSERVATION_ONLY",
      "OBSERVATION_ONLY",
      "OBSERVATION_ONLY",
      "OBSERVATION_ONLY",
      "OBSERVATION_ONLY",
      "OBSERVATION_ONLY",
      "OBSERVATION_ONLY",
      "OBSERVATION_ONLY",
      "OBSERVATION_ONLY",
      "OBSERVATION_ONLY",
      "OBSERVATION_ONLY",
      "OBSERVATION_ONLY",
      "OBSERVATION_ONLY",
      "OBSERVATION_ONLY",
      "OBSERVATION_ONLY",
      "OBSERVATION_ONLY",
      "OBSERVATION_ONLY",
      "OBSERVATION_ONLY",
      "OBSERVATION_ONLY",
      "OBSERVATION_ONLY",
      "OBSERVATION_ONLY",
      "OBSERVATION_ONLY",
      "OBSERVATION_ONLY",
      "OBSERVATION_ONLY",
      "OBSERVATION_ONLY",
      "OBSERVATION_ONLY",
      "OBSERVATION_ONLY",
      "OBSERVATION_ONLY",
      "OBSERVATION_ONLY",
      "OBSERVATION_ONLY",
      "OBSERVATION_ONLY",
      "OBSERVATION_ONLY",
      "OBSERVATION_ONLY",
      "OBSERVATION_ONLY",
      "OBSERVATION_ONLY",
      "OBSERVATION_ONLY",
      "OBSERVATION_ONLY",
      "OBSERVATION_ONLY",
      "OBSERVATION_ONLY",
      "OBSERVATION_ONLY",
      "OBSERVATION_ONLY",
      "OBSERVATION_ONLY",
      "OBSERVATION_ONLY",
      "OBSERVATION_ONLY",
      "OBSERVATION_ONLY",
      "OBSERVATION_ONLY",
      "OBSERVATION_ONLY",
      "OBSERVATION_ONLY",
      "OBSERVATION_ONLY",
      "OBSERVATION_ONLY",
      "OBSERVATION_ONLY",
      "OBSERVATION_ONLY",
      "OBSERVATION_ONLY",
      "OBSERVATION_ONLY",
      "OBSERVATION_ONLY",
      "OBSERVATION_ONLY",
      "OBSERVATION_ONLY",
      "OBSERVATION_ONLY",
      "OBSERVATION_ONLY",
      "OBSERVATION_ONLY",
      "OBSERVATION_ONLY",
      "OBSERVATION_ONLY",
      "OBSERVATION_ONLY",
      "OBSERVATION_ONLY",
      "OBSERVATION_ONLY",
      "OBSERVATION_ONLY",
      "OBSERVATION_ONLY",
      "OBSERVATION_ONLY",
      "OBSERVATION_ONLY",
      "OBSERVATION_ONLY",
      "OBSERVATION_ONLY",
      "OBSERVATION_ONLY",
      "OBSERVATION_ONLY",
      "OBSERVATION_ONLY",
      "OBSERVATION_ONLY",
      "OBSERVATION_ONLY",
      "OBSERVATION_ONLY",
      "OBSERVATION_ONLY",
      "OBSERVATION_ONLY",
      "OBSERVATION_ONLY",
      "OBSERVATION_ONLY",
      "OBSERVATION_ONLY",
      "OBSERVATION_ONLY",
      "OBSERVATION_ONLY",
      "OBSERVATION_ONLY",
      "OBSERVATION_ONLY",
      "OBSERVATION_ONLY",
      "OBSERVATION_ONLY",
      "OBSERVATION_ONLY",
      "OBSERVATION_ONLY",
      "OBSERVATION_ONLY",
      "OBSERVATION_ONLY",
      "OBSERVATION_ONLY",
      "OBSERVATION_ONLY",
      "OBSERVATION_ONLY",
      "OBSERVATION_ONLY",
      "OBSERVATION_ONLY",
      "OBSERVATION_ONLY",
      "OBSERVATION_ONLY",
      "OBSERVATION_ONLY",
      "OBSERVATION_ONLY",
      "OBSERVATION_ONLY",
      "OBSERVATION_ONLY",
      "OBSERVATION_ONLY",
      "OBSERVATION_ONLY",
      "OBSERVATION_ONLY",
      "OBSERVATION_ONLY",
      "OBSERVATION_ONLY",
      "OBSERVATION_ONLY",
      "OBSERVATION_ONLY",
      "OBSERVATION_ONLY",
      "OBSERVATION_ONLY",
      "OBSERVATION_ONLY",
      "OBSERVATION_ONLY",
      "OBSERVATION_ONLY",
      "OBSERVATION_ONLY",
      "OBSERVATION_ONLY",
      "OBSERVATION_ONLY",
      "OBSERVATION_ONLY",
      "OBSERVATION_ONLY",
      "OBSERVATION_ONLY",
      "OBSERVATION_ONLY",
      "OBSERVATION_ONLY",
      "OBSERVATION_ONLY",
      "OBSERVATION_ONLY",
      "OBSERVATION_ONLY",
      "OBSERVATION_ONLY",
      "OBSERVATION_ONLY",
      "OBSERVATION_ONLY",
      "OBSERVATION_ONLY",
      "OBSERVATION_ONLY",
      "OBSERVATION_ONLY",
      "OBSERVATION_ONLY",
      "OBSERVATION_ONLY",
      "OBSERVATION_ONLY",
      "OBSERVATION_ONLY",
      "OBSERVATION_ONLY",
      "OBSERVATION_ONLY",
      "OBSERVATION_ONLY",
      "OBSERVATION_ONLY",
      "OBSERVATION_ONLY",
      "OBSERVATION_ONLY",
      "OBSERVATION_ONLY",
      "OBSERVATION_ONLY",
      "OBSERVATION_ONLY",
      "OBSERVATION_ONLY",
      "OBSERVATION_ONLY",
      "OBSERVATION_ONLY",
      "OBSERVATION_ONLY",
      "OBSERVATION_ONLY",
      "OBSERVATION_ONLY",
      "OBSERVATION_ONLY",
      "OBSERVATION_ONLY",
      "OBSERVATION_ONLY",
      "OBSERVATION_ONLY",
      "OBSERVATION_ONLY",
      "OBSERVATION_ONLY",
      "OBSERVATION_ONLY",
      "OBSERVATION_ONLY",
      "OBSERVATION_ONLY",
      "OBSERVATION_ONLY",
      "OBSERVATION_ONLY",
      "OBSERVATION_ONLY",
      "OBSERVATION_ONLY",
      "OBSERVATION_ONLY",
      "OBSERVATION_ONLY",
      "OBSERVATION_ONLY",
      "OBSERVATION_ONLY",
      "OBSERVATION_ONLY",
      "OBSERVATION_ONLY",
      "OBSERVATION_ONLY",
      "OBSERVATION_ONLY",
      "OBSERVATION_ONLY",
      "OBSERVATION_ONLY",
      "OBSERVATION_ONLY",
      "OBSERVATION_ONLY",
      "OBSERVATION_ONLY",
      "OBSERVATION_ONLY",
      "OBSERVATION_ONLY",
      "OBSERVATION_ONLY",
      "OBSERVATION_ONLY",